{
  "$schema": "../schema/sbom.schema.v1.json",
  "subject": {
    "name": "qrap-demo-web-client",
    "version": "0.1.0",
    "type": "application"
  },
  "sbom_version": "1.0.0",
  "generated_at": "1970-01-01T00:00:00Z",
  "generator": {
    "name": "example-generator",
    "version": "0.0.0"
  },
  "packages": [
    {
      "name": "qrap-core",
      "version": "0.1.0",
      "type": "cargo",
      "license": "MIT",
      "purl": "pkg:cargo/qrap-core@0.1.0",
      "direct": true
    },
    {
      "name": "sha2",
      "version": "0.10.0",
      "type": "cargo",
      "license": "MIT OR Apache-2.0",
      "purl": "pkg:cargo/sha2@0.10.0",
      "direct": false
    },
    {
      "name": "wasm-bindgen",
      "version": "0.2.0",
      "type": "cargo",
      "license": "MIT OR Apache-2.0",
      "purl": "pkg:cargo/wasm-bindgen@0.2.0",
      "direct": true
    },
    {
      "name": "pyo3",
      "version": "0.20.0",
      "type": "cargo",
      "license": "MIT OR Apache-2.0",
      "purl": "pkg:cargo/pyo3@0.20.0",
      "direct": true
    },
    {
      "name": "express",
      "version": "4.18.0",
      "type": "npm",
      "license": "MIT",
      "purl": "pkg:npm/express@4.18.0",
      "direct": true
    }
  ],
  "relationships": [
    {
      "from": "qrap-core",
      "to": "sha2",
      "type": "depends-on"
    },
    {
      "from": "qrap-demo-web-client",
      "to": "qrap-core",
      "type": "depends-on"
    },
    {
      "from": "qrap-demo-web-client",
      "to": "wasm-bindgen",
      "type": "depends-on"
    }
  ]
}

